{
  "number": "SC-1",
  "signed_on": "14.08.2026",
  "employer": {
    "name": "Работодатель Тестов ТОО",
    "bin": "104332181962",
    "director": "Тестов Т.Т."
  },
  "employee": {
    "full_name": "Работников Р.Р.",
    "iin": "900112350487",
    "position": "Тестировщик"
  },
  "salary_tenge": "1 000,00",
  "salary_words": "Одна тысяча тенге 00 тиын",
  "starts_on": "18.08.2026",
  "work_schedule": "50% & \"к\" #1 _t_ {б} \\б $5 ^верх ~тильда <уголки>"
}
