{
  "number": "17",
  "signed_on": "14.08.2026",
  "employer": {
    "name": "Cyber Capybara ТОО",
    "bin": "104332181962",
    "address": "г. Алматы, ул. Абая, 150, оф. 12",
    "director": "Ахметов Ерлан Серикович, Устав негізінде / на основании Устава"
  },
  "employee": {
    "full_name": "Серикбаева Айгерим Кайратовна",
    "iin": "900112350487",
    "address": "г. Алматы, мкр. Самал-2, д. 33, кв. 45",
    "position": "Бухгалтер"
  },
  "salary_tenge": "300 000,00",
  "salary_words": "Триста тысяч тенге 00 тиын",
  "starts_on": "18.08.2026",
  "ends_on": "17.08.2027",
  "probation_months": "3",
  "work_schedule": "Пятидневная рабочая неделя, с 09:00 до 18:00, обеденный перерыв с 13:00 до 14:00, выходные — суббота и воскресенье."
}
